{
  "major_support_gaps": [
    "The visible pages strongly support LoRA's practical effectiveness, but they do not fully characterize failure modes or when low-rank adaptation is insufficient.",
    "The GPT-3-scale efficiency claims are persuasive but less fully broken down than the task tables.",
    "The paper focuses more on showing broad competitiveness than on deeply isolating which parts of the design are most responsible for the gains."
  ],
  "fairness_of_comparisons": [
    "The benchmark comparisons are fairly broad and include multiple strong parameter-efficient baselines as well as full fine-tuning.",
    "Some baseline numbers are reused from prior work where possible, which is pragmatic but introduces dependence on those reported setups.",
    "The paper appears careful about comparing trainable parameter counts, but practical engineering cost beyond those counts is not always equally detailed for every method."
  ],
  "possible_confounds": [
    "Some gains may depend not only on low-rank parameterization itself but also on the specific choice to target attention projections.",
    "Task-specific training recipe differences across model families may interact with the method's apparent strength.",
    "The no-latency advantage depends on the chosen deployment path and may not hold equally for all multi-task operational scenarios."
  ],
  "assumption_risks": [
    "The method assumes useful adaptation updates are low-rank enough to be captured with small r.",
    "It assumes attention-weight adaptation captures most of the needed downstream adjustment in many settings.",
    "It assumes mergeability into base weights is operationally acceptable for the intended deployment workflow."
  ],
  "missing_evidence_that_would_change_confidence": [
    "A clearer analysis of tasks where low-rank adaptation fails would sharpen the method boundary.",
    "More exhaustive placement ablations across layers and modules would clarify whether the visible configuration is broadly optimal or just a strong default.",
    "More detailed deployment studies on task switching and multi-task serving would strengthen the practical latency story further."
  ],
  "overall_critical_take": "LoRA is convincing because it makes a narrow, practical bet and supports it well: many downstream adaptations do not need full-parameter updates. The visible evidence strongly supports LoRA as an unusually clean parameter-efficient adaptation method with real storage, memory, and deployment benefits. Its importance for agent systems is indirect rather than native, but as a model-adaptation primitive it is a strong anchor paper for any stack-level review."
}
