{
  "major_support_gaps": [
    "The paper gives a strong controlled study, but the selected architecture set and benchmark suite still leave open whether the same principles hold under very different deployment regimes.",
    "Some mechanistic claims about why vendor-specific differences arise remain suggestive rather than fully resolved.",
    "The predictive model is impressive, but it still explains only about half the variance, leaving substantial unmodeled factors."
  ],
  "fairness_of_comparisons": [
    "The paper makes a serious effort to equalize prompts, tools, and token budgets, which substantially improves comparison fairness relative to much prior agent-systems work.",
    "Using normalized scores relative to SAS is a reasonable design choice for architecture-effect analysis.",
    "Some residual fairness concerns remain because real systems may differ in tooling and orchestration quality beyond what controlled abstraction can capture."
  ],
  "possible_confounds": [
    "Measured coordination metrics may partly reflect implementation choices rather than purely architectural essence.",
    "Task-domain effects may interact with hidden benchmark-specific artifacts not fully captured by decomposability or complexity proxies.",
    "Vendor-specific architecture effects could partly reflect prompt-following style, context usage, or hidden system behavior beyond nominal model capability."
  ],
  "assumption_risks": [
    "The paper assumes its selected coordination metrics are sufficient proxies for the main mechanisms driving agent-system performance.",
    "It assumes matched token budgets are an appropriate control for cross-architecture fairness.",
    "It assumes the chosen benchmark suite spans enough task structure diversity to ground general architecture-selection rules."
  ],
  "missing_evidence_that_would_change_confidence": [
    "Replication on additional benchmarks and newer agent environments would strengthen confidence in the claimed scaling principles.",
    "Open-source implementations of the evaluated architectures and metric pipeline would make the causal claims easier to audit.",
    "A stronger causal breakdown of vendor-specific interactions would help move from descriptive findings to more portable design rules."
  ],
  "overall_critical_take": "This is a valuable paper because it asks a better question than most agent-systems work: not whether multi-agent can ever help, but when and why. Its strongest contribution is the controlled comparative frame and the attempt to extract predictive rules from measurable coordination properties. The evidence convincingly rejects naive 'more agents is better' heuristics and offers a plausible first-generation science of architecture selection. The main caveat is that the resulting rules are still contingent on the chosen metrics, benchmarks, and architecture family definitions, so they should be treated as a strong foundation rather than a final law of agent scaling."
}
