{
  "major_support_gaps": [
    "The paper strongly motivates next-state learning, but the evidence for broad universality across all agent types remains narrower than the headline suggests.",
    "The infrastructure claim is clear architecturally, but there is less end-to-end operational evidence about long-term production reliability and serving/training interference.",
    "The strongest general-agent results show viability and improvement trends, but not a broad benchmark sweep against many competing agent-training systems."
  ],
  "fairness_of_comparisons": [
    "The personal-agent method comparison among Binary RL, OPD, and Combined is straightforward and reasonably fair within the reported setup.",
    "The process-reward comparison against outcome-only optimization is directionally fair, though limited to a small set of settings and metrics.",
    "Broader comparisons to prior RL-for-agents work are mostly narrative rather than direct head-to-head benchmark tables."
  ],
  "possible_confounds": [
    "Part of the reported gains may depend on judge quality or prompt engineering rather than solely on the next-state-learning principle.",
    "Simulated personal-agent tasks may not fully capture the messiness of real user feedback streams.",
    "The same-model teacher construction used in OPD could blur the distinction between improved supervision and prompt conditioning effects."
  ],
  "assumption_risks": [
    "The framework assumes that next-state signals are sufficiently informative and attributable to the immediately preceding action.",
    "It assumes one policy can learn effectively from multiple heterogeneous environments within the same training loop.",
    "It assumes high-quality directive hints can be extracted reliably enough to support token-level supervision."
  ],
  "missing_evidence_that_would_change_confidence": [
    "More direct production-style evaluations with real human users and noisy environments would strengthen confidence.",
    "More head-to-head comparisons against alternative online agent-learning systems would clarify relative advantage.",
    "A deeper ablation of judge quality, hint extraction quality, and asynchronous scheduling would help isolate which components matter most."
  ],
  "overall_critical_take": "OpenClaw-RL is an ambitious and practically interesting paper because it moves the learning source closer to real deployment: the next state itself. The paper's strongest contribution is not any single reward formula but the unification of multiple interaction settings under one online-learning story, with a concrete distinction between evaluative and directive signals. The evidence supports that this is workable and often useful, especially when Binary RL and OPD are combined. The more expansive claim that any agent can simply be trained by talking should still be read as an aspirational framing supported by promising but still bounded experiments."
}
