{
  "major_support_gaps": [
    "The paper’s strongest broad claim—surpassing reasoning-native systems such as o3-high and DeepSeek R1—is only partially supported by the task-level table and should be stated more narrowly.",
    "The evidence for quantum advantage is modest and limited to one model configuration, so the paper does not yet show a strong or general quantum benefit.",
    "The benchmark scope is too narrow to support broad claims about large-language-model reasoning in general."
  ],
  "fairness_of_comparisons": [
    "The comparisons to base models appear fair at a high level because QCR-LLM is explicitly built on top of those same base models.",
    "Comparisons to reasoning-native systems are directionally useful but not perfectly clean because those systems have different reasoning mechanisms and possibly different serving or prompting behaviors.",
    "The energy comparison is informative but not fully apples-to-apples because the quantum backend cost is not fully included."
  ],
  "possible_confounds": [
    "A portion of the improvement may come from multi-sample reasoning and structured re-prompting rather than specifically from higher-order quantum optimization.",
    "The quality of the fragment extraction and semantic normalization stage may materially affect downstream gains, making it a hidden confound.",
    "Differences in the number and diversity of sampled completions across models may influence outcomes independently of the optimization formalism."
  ],
  "assumption_risks": [
    "The method assumes that low-energy fragment subsets correspond to better reasoning quality in a sufficiently robust way across tasks.",
    "It assumes that atomic reasoning fragments remain meaningful and composable after extraction and normalization.",
    "It assumes the frequency of appearance in low-energy solutions is a good proxy for reasoning-fragment stability and usefulness."
  ],
  "missing_evidence_that_would_change_confidence": [
    "A broader benchmark evaluation across more reasoning tasks would strengthen confidence in the generality of the method.",
    "A stronger ablation isolating the contribution of higher-order modeling versus simpler multi-sample aggregation would clarify what drives the gains.",
    "A fuller energy accounting including quantum backend costs would make the efficiency story much more convincing.",
    "Replication by an independent group or release of a more complete reference implementation would increase confidence in reproducibility."
  ],
  "overall_critical_take": "This is a genuinely interesting systems-and-method paper with a clear architectural idea: treat reasoning aggregation as a structured optimization problem over fragments. The evidence strongly supports that this approach improves over the corresponding base models in the reported benchmark slice. The paper is less convincing when it frames itself as broadly surpassing reasoning-native systems or as demonstrating strong quantum advantage. A fair reading is that it provides promising early evidence for optimization-based reasoning aggregation and cautious, limited evidence that direct higher-order quantum optimization may help in some settings."
}
